<?xml version="1.0" encoding="utf-8" standalone="no"?>
<!DOCTYPE MENUE SYSTEM "menue.dtd">
<?xml-stylesheet type="text/xsl" href="../../xml/dtd_xsl/menue.xsl" ?>
<MENUE>
  <MENUENAME>Salatemen&#252;</MENUENAME>
  <LINK>
    <LINKNAME>
    <FETT>Kochbuch</FETT>
    <ZEILENUMBRUCH />
    <ZEILENUMBRUCH />&#160;</LINKNAME>
    <LINKADRESSE>../../index.htm</LINKADRESSE>
    <LINKAUSGABE>_top</LINKAUSGABE>
  </LINK>
  <LINK>
    <LINKNAME>
    <FETT>Salate</FETT>
    <ZEILENUMBRUCH />&#160;</LINKNAME>
    <LINKADRESSE>salatemenue.xml</LINKADRESSE>
    <LINKAUSGABE>Inhalt</LINKAUSGABE>
  </LINK>
  <LINK>
    <LINKNAME>Bohnensalat</LINKNAME>
    <LINKADRESSE>../salate/Bohnensalat.xml</LINKADRESSE>
    <LINKAUSGABE>Hauptfenster</LINKAUSGABE>
  </LINK>
  <LINK>
    <LINKNAME>Gurkensalat</LINKNAME>
    <LINKADRESSE>../salate/Gurkensalat.xml</LINKADRESSE>
    <LINKAUSGABE>Hauptfenster</LINKAUSGABE>
  </LINK>
  <LINK>
    <LINKNAME>Kartoffelsalat</LINKNAME>
    <LINKADRESSE>../salate/Kartoffelsalat.xml</LINKADRESSE>
    <LINKAUSGABE>Hauptfenster</LINKAUSGABE>
  </LINK>
  <LINK>
    <LINKNAME>Wei&#223;kohlsalat</LINKNAME>
    <LINKADRESSE>../salate/Weisskohlsalat.xml</LINKADRESSE>
    <LINKAUSGABE>Hauptfenster</LINKAUSGABE>
  </LINK>
</MENUE>