<?xml version="1.0" encoding="utf-8" standalone="no"?>
<!DOCTYPE MENUE SYSTEM "menue.dtd">
<?xml-stylesheet type="text/xsl" href="../../xml/dtd_xsl/menue.xsl" ?>
<MENUE>
  <MENUENAME>Backenmen&#252;</MENUENAME>
  <LINK>
    <LINKNAME>
    <FETT>Kochbuch</FETT>
    <ZEILENUMBRUCH />
    <ZEILENUMBRUCH />&#160;</LINKNAME>
    <LINKADRESSE>../../index.htm</LINKADRESSE>
    <LINKAUSGABE>_top</LINKAUSGABE>
  </LINK>
  <LINK>
    <LINKNAME>
    <FETT>Backen</FETT>
    <ZEILENUMBRUCH />&#160;</LINKNAME>
    <LINKADRESSE>backenmenuemenue.xml</LINKADRESSE>
    <LINKAUSGABE>Inhalt</LINKAUSGABE>
  </LINK>
  <LINK>
    <LINKNAME>Ananas- Mandarinen- Torte</LINKNAME>
    <LINKADRESSE>../rezepte/backen/Ananas-Mandarinen-Torte.xml</LINKADRESSE>
    <LINKAUSGABE>Hauptfenster</LINKAUSGABE>
  </LINK>
  <LINK>
    <LINKNAME>Biskuitboden</LINKNAME>
    <LINKADRESSE>../rezepte/backen/Biskuitboden.xml</LINKADRESSE>
    <LINKAUSGABE>Hauptfenster</LINKAUSGABE>
  </LINK>
  <LINK>
    <LINKNAME>K&#228;setorte ohne Boden</LINKNAME>
    <LINKADRESSE>../rezepte/backen/Kaeseohneboden.xml</LINKADRESSE>
    <LINKAUSGABE>Hauptfenster</LINKAUSGABE>
  </LINK>
  <LINK>
    <LINKNAME>Kokosmakronen</LINKNAME>
    <LINKADRESSE>../rezepte/backen/Kokosmakronen.xml</LINKADRESSE>
    <LINKAUSGABE>Hauptfenster</LINKAUSGABE>
  </LINK>
  <LINK>
    <LINKNAME>Kokospl&#228;tzchen</LINKNAME>
    <LINKADRESSE>../rezepte/backen/Kokosplaetzchen.xml</LINKADRESSE>
    <LINKAUSGABE>Hauptfenster</LINKAUSGABE>
  </LINK>
  <LINK>
    <LINKNAME>Philadelphie- K&#228;se- Torte</LINKNAME>
    <LINKADRESSE>../rezepte/backen/Philadelphia-Kaese-Torte.xml</LINKADRESSE>
    <LINKAUSGABE>Hauptfenster</LINKAUSGABE>
  </LINK>
  <LINK>
    <LINKNAME>Raffaello Torte</LINKNAME>
    <LINKADRESSE>../rezepte/backen/Raffaello-Torte.xml</LINKADRESSE>
    <LINKAUSGABE>Hauptfenster</LINKAUSGABE>
  </LINK>
  <LINK>
    <LINKNAME>Rotk&#228;ppchenkuchen</LINKNAME>
    <LINKADRESSE>../rezepte/backen/Rotkaepchenkuchen.xml</LINKADRESSE>
    <LINKAUSGABE>Hauptfenster</LINKAUSGABE>
  </LINK>
  <LINK>
    <LINKNAME>Sprudelkuchen</LINKNAME>
    <LINKADRESSE>../rezepte/backen/Sprudelkuchen.xml</LINKADRESSE>
    <LINKAUSGABE>Hauptfenster</LINKAUSGABE>
  </LINK>
  <LINK>
    <LINKNAME>Stachelbeer- Butterkeks- Kuchen</LINKNAME>
    <LINKADRESSE>../rezepte/backen/Stachelbeer_Butterkeks_Kuchen.xml</LINKADRESSE>
    <LINKAUSGABE>Hauptfenster</LINKAUSGABE>
  </LINK>
  <LINK>
    <LINKNAME>Waffeln</LINKNAME>
    <LINKADRESSE>../rezepte/backen/Waffeln.xml</LINKADRESSE>
    <LINKAUSGABE>Hauptfenster</LINKAUSGABE>
  </LINK>
</MENUE>