<?xml version="1.0" encoding="utf-8" standalone="no"?>
<!DOCTYPE MENUE SYSTEM "menue.dtd">
<?xml-stylesheet type="text/xsl" href="../../xml/dtd_xsl/menue.xsl" ?>
<MENUE>
  <MENUENAME>Im Backofen Men&#252;</MENUENAME>
  <LINK>
    <LINKNAME>
    <FETT>Kochbuch</FETT>
    <ZEILENUMBRUCH />
    <ZEILENUMBRUCH />&#160;</LINKNAME>
    <LINKADRESSE>../../index.htm</LINKADRESSE>
    <LINKAUSGABE>_top</LINKAUSGABE>
  </LINK>
  <LINK>
    <LINKNAME>
    <FETT>im Backofen</FETT>
    <ZEILENUMBRUCH />&#160;</LINKNAME>
    <LINKADRESSE>imbackofenmenue.xml</LINKADRESSE>
    <LINKAUSGABE>Inhalt</LINKAUSGABE>
  </LINK>
  <LINK>
    <LINKNAME>Backofensuppe</LINKNAME>
    <LINKADRESSE>../rezepte/imbackofen/Backofensuppe.xml</LINKADRESSE>
    <LINKAUSGABE>Hauptfenster</LINKAUSGABE>
  </LINK>
  <LINK>
    <LINKNAME>Eine Karre Mist</LINKNAME>
    <LINKADRESSE>../rezepte/imbackofen/Eine-Karre-Mist.xml</LINKADRESSE>
    <LINKAUSGABE>Hauptfenster</LINKAUSGABE>
  </LINK>
  <LINK>
    <LINKNAME>H&#228;hnchen portugiesisch</LINKNAME>
    <LINKADRESSE>../rezepte/imbackofen/Haehnchen-portugiesisch.xml</LINKADRESSE>
    <LINKAUSGABE>Hauptfenster</LINKAUSGABE>
  </LINK>
  <LINK>
    <LINKNAME>Kaukasisches Reiterfleisch</LINKNAME>
    <LINKADRESSE>../rezepte/imbackofen/Kaukasisches-Reiterfleisch.xml</LINKADRESSE>
    <LINKAUSGABE>Hauptfenster</LINKAUSGABE>
  </LINK>
  <LINK>
    <LINKNAME>Paprikapfanne mit Schweinekamm</LINKNAME>
    <LINKADRESSE>../rezepte/imbackofen/Paprikapfanne-mit-Schweinekamm.xml</LINKADRESSE>
    <LINKAUSGABE>Hauptfenster</LINKAUSGABE>
  </LINK>
  <LINK>
    <LINKNAME>R&#228;uberhachbraten</LINKNAME>
    <LINKADRESSE>../rezepte/imbackofen/Raeuberhackbraten.xml</LINKADRESSE>
    <LINKAUSGABE>Hauptfenster</LINKAUSGABE>
  </LINK>
  <LINK>
    <LINKNAME>Saftige Schnitzel- Pizza</LINKNAME>
    <LINKADRESSE>../rezepte/imbackofen/Saftige-Schnitzel-Pizza.xml</LINKADRESSE>
    <LINKAUSGABE>Hauptfenster</LINKAUSGABE>
  </LINK>
</MENUE>