<?xml version="1.0" encoding="utf-8" standalone="no"?>
<!DOCTYPE MENUE SYSTEM "menue.dtd">
<?xml-stylesheet type="text/xsl" href="../../xml/dtd_xsl/menue.xsl" ?>
<MENUE>
  <MENUENAME>Fleischgerichte Men&#252;</MENUENAME>
  <LINK>
    <LINKNAME>
    <FETT>Kochbuch</FETT>
    <ZEILENUMBRUCH />
    <ZEILENUMBRUCH />&#160;</LINKNAME>
    <LINKADRESSE>../../index.htm</LINKADRESSE>
    <LINKAUSGABE>_top</LINKAUSGABE>
  </LINK>
  <LINK>
    <LINKNAME>
    <FETT>Fleischgerichte</FETT>
    <ZEILENUMBRUCH />&#160;</LINKNAME>
    <LINKADRESSE>fleischgerichtemenue.xml</LINKADRESSE>
    <LINKAUSGABE>Inhalt</LINKAUSGABE>
  </LINK>
  <LINK>
    <LINKNAME>Boulettenmasse</LINKNAME>
    <LINKADRESSE>../rezepte/fleischgerichte/Boulettenmasse.xml</LINKADRESSE>
    <LINKAUSGABE>Hauptfenster</LINKAUSGABE>
  </LINK>
  <LINK>
    <LINKNAME>Boulettentopf</LINKNAME>
    <LINKADRESSE>../rezepte/fleischgerichte/Boulettentopf.xml</LINKADRESSE>
    <LINKAUSGABE>Hauptfenster</LINKAUSGABE>
  </LINK>
  <LINK>
    <LINKNAME>H&#228;hnchengeschnetzeltes Stroganoff</LINKNAME>
    <LINKADRESSE>../rezepte/fleischgerichte/Haehnchengeschnetzeltes-Stroganoff.xml</LINKADRESSE>
    <LINKAUSGABE>Hauptfenster</LINKAUSGABE>
  </LINK>
  <LINK>
    <LINKNAME>K&#246;nigsberger Klopse</LINKNAME>
    <LINKADRESSE>../rezepte/fleischgerichte/Koenigsbergerklopse.xml</LINKADRESSE>
    <LINKAUSGABE>Hauptfenster</LINKAUSGABE>
  </LINK>
  <LINK>
    <LINKNAME>Kohlrouladen</LINKNAME>
    <LINKADRESSE>../rezepte/fleischgerichte/Kohlrouladen.xml</LINKADRESSE>
    <LINKAUSGABE>Hauptfenster</LINKAUSGABE>
  </LINK>
</MENUE>