<?xml version="1.0" encoding="utf-8" standalone="no"?>
<!DOCTYPE MENUE SYSTEM "menue.dtd">
<?xml-stylesheet type="text/xsl" href="../../xml/dtd_xsl/menue.xsl" ?>
<MENUE>
  <MENUENAME>Gem&#252;sebeilagen</MENUENAME>
  <LINK>
    <LINKNAME>
    <FETT>Kochbuch</FETT>
    <ZEILENUMBRUCH />
    <ZEILENUMBRUCH />&#160;</LINKNAME>
    <LINKADRESSE>../../index.htm</LINKADRESSE>
    <LINKAUSGABE>_top</LINKAUSGABE>
  </LINK>
  <LINK>
    <LINKNAME>
    <FETT>Gem&#252;sebeilagen</FETT>
    <ZEILENUMBRUCH />&#160;</LINKNAME>
    <LINKADRESSE>gemuesebeilagenmenue.xml</LINKADRESSE>
    <LINKAUSGABE>Inhalt</LINKAUSGABE>
  </LINK>
  <LINK>
    <LINKNAME>Paprikagem√ºse</LINKNAME>
    <LINKADRESSE>../Gemuesebeilagen/PaprikaGemuesel.xml</LINKADRESSE>
    <LINKAUSGABE>Hauptfenster</LINKAUSGABE>
  </LINK>
  <LINK>
    <LINKNAME>Rosenkohl</LINKNAME>
    <LINKADRESSE>../Gemuesebeilagen/Rosenkohl.xml</LINKADRESSE>
    <LINKAUSGABE>Hauptfenster</LINKAUSGABE>
  </LINK>
  <LINK>
    <LINKNAME>Rotkohl</LINKNAME>
    <LINKADRESSE>../Gemuesebeilagen/Rotkohl.xml</LINKADRESSE>
    <LINKAUSGABE>Hauptfenster</LINKAUSGABE>
  </LINK>
  <LINK>
    <LINKNAME>Sauerkraut</LINKNAME>
    <LINKADRESSE>../Gemuesebeilagen/Sauerkraut.xml</LINKADRESSE>
    <LINKAUSGABE>Hauptfenster</LINKAUSGABE>
  </LINK>
  <LINK>
    <LINKNAME>Spargel</LINKNAME>
    <LINKADRESSE>../Gemuesebeilagen/Spargel.xml</LINKADRESSE>
    <LINKAUSGABE>Hauptfenster</LINKAUSGABE>
  </LINK>
</MENUE>