<?xml version="1.0" encoding="utf-8" standalone="no"?>
<!DOCTYPE MENUE SYSTEM "menue.dtd">
<?xml-stylesheet type="text/xsl" href="menue.xsl" ?>
<MENUE>
 <MENUENAME>Grillmen&#252;</MENUENAME>
 <LINK>
  <LINKNAME>
  <FETT>Kochbuch</FETT>
  <ZEILENUMBRUCH />
  <ZEILENUMBRUCH />&#160;</LINKNAME>
  <LINKADRESSE>../index.htm</LINKADRESSE>
  <LINKAUSGABE>_top</LINKAUSGABE>
 </LINK>
 <LINK>
  <LINKNAME>
  <FETT>Auf dem Grill</FETT>
  <ZEILENUMBRUCH />&#160;</LINKNAME>
  <LINKADRESSE>grill.xml</LINKADRESSE>
  <LINKAUSGABE>Inhalt</LINKAUSGABE>
 </LINK>
 <LINK>
  <LINKNAME>Grillschnitte</LINKNAME>
  <LINKADRESSE>../grill/grillschnitte.xml</LINKADRESSE>
  <LINKAUSGABE>Hauptfenster</LINKAUSGABE>
 </LINK>
</MENUE>