<?xml version="1.0" encoding="utf-8" standalone="no"?>
<!DOCTYPE MENUE SYSTEM "../../xml/dtd_xsl/menue.dtd">
<?xml-stylesheet type="application/xml" href="../../xml/dtd_xsl/menue.xsl"?>
<MENUE>
  <MENUENAME>Gem&#252;sebeilagen</MENUENAME>
  <LINK>
    <LINKNAME>
    <FETT>Kochbuch</FETT>
    <ZEILENUMBRUCH />
    <ZEILENUMBRUCH />&#160;</LINKNAME>
    <LINKADRESSE>../../index.htm</LINKADRESSE>
    <LINKAUSGABE>_top</LINKAUSGABE>
  </LINK>
  <LINK>
    <LINKNAME>
    <FETT>Gem&#252;sebeilagen</FETT>
    <ZEILENUMBRUCH />&#160;</LINKNAME>
    <LINKADRESSE>gemueseMenue.xml</LINKADRESSE>
    <LINKAUSGABE>Inhalt</LINKAUSGABE>
  </LINK>
  <LINK>
    <LINKNAME>Paprikagem√ºse</LINKNAME>
    <LINKADRESSE>../rezepte/gemuese/paprikaGemuese.xml</LINKADRESSE>
    <LINKAUSGABE>Hauptfenster</LINKAUSGABE>
  </LINK>
  <LINK>
    <LINKNAME>Rosenkohl</LINKNAME>
    <LINKADRESSE>../rezepte/gemuese/rosenKohl.xml</LINKADRESSE>
    <LINKAUSGABE>Hauptfenster</LINKAUSGABE>
  </LINK>
  <LINK>
    <LINKNAME>Rotkohl</LINKNAME>
    <LINKADRESSE>../rezepte/gemuese/rotKohl.xml</LINKADRESSE>
    <LINKAUSGABE>Hauptfenster</LINKAUSGABE>
  </LINK>
  <LINK>
    <LINKNAME>Sauerkraut</LINKNAME>
    <LINKADRESSE>../rezepte/gemuese/sauerKraut.xml</LINKADRESSE>
    <LINKAUSGABE>Hauptfenster</LINKAUSGABE>
  </LINK>
  <LINK>
    <LINKNAME>Spargel</LINKNAME>
    <LINKADRESSE>../rezepte/gemuese/spargel.xml</LINKADRESSE>
    <LINKAUSGABE>Hauptfenster</LINKAUSGABE>
  </LINK>
</MENUE>