<?xml version="1.0" encoding="utf-8" standalone="no"?>
<!DOCTYPE MENUE SYSTEM "../../xml/dtd_xsl/menue.dtd">
<?xml-stylesheet type="application/xml" href="../../xml/dtd_xsl/menue.xsl"?>
<MENUE>
  <MENUENAME>Fleischgerichte Men&#252;</MENUENAME>
  <LINK>
    <LINKNAME>
    <FETT>Kochbuch</FETT>
    <ZEILENUMBRUCH />
    <ZEILENUMBRUCH />&#160;</LINKNAME>
    <LINKADRESSE>../../index.htm</LINKADRESSE>
    <LINKAUSGABE>_top</LINKAUSGABE>
  </LINK>
  <LINK>
    <LINKNAME>
    <FETT>Fleischgerichte</FETT>
    <ZEILENUMBRUCH />&#160;</LINKNAME>
    <LINKADRESSE>fleischMenue.xml</LINKADRESSE>
    <LINKAUSGABE>Inhalt</LINKAUSGABE>
  </LINK>
  <LINK>
    <LINKNAME>Boulettenmasse</LINKNAME>
    <LINKADRESSE>../rezepte/fleisch/boulettenMasse.xml</LINKADRESSE>
    <LINKAUSGABE>Hauptfenster</LINKAUSGABE>
  </LINK>
  <LINK>
    <LINKNAME>Boulettentopf</LINKNAME>
    <LINKADRESSE>../rezepte/fleisch/boulettenTopf.xml</LINKADRESSE>
    <LINKAUSGABE>Hauptfenster</LINKAUSGABE>
  </LINK>
  <LINK>
    <LINKNAME>H&#228;hnchengeschnetzeltes Stroganoff</LINKNAME>
    <LINKADRESSE>../rezepte/fleisch/haehnchenGeschnetzeltesStroganoff.xml</LINKADRESSE>
    <LINKAUSGABE>Hauptfenster</LINKAUSGABE>
  </LINK>
  <LINK>
    <LINKNAME>K&#246;nigsberger Klopse</LINKNAME>
    <LINKADRESSE>../rezepte/fleisch/koenigsbergerKlopse.xml</LINKADRESSE>
    <LINKAUSGABE>Hauptfenster</LINKAUSGABE>
  </LINK>
  <LINK>
    <LINKNAME>Kohlrouladen</LINKNAME>
    <LINKADRESSE>../rezepte/fleisch/kohlrouladen.xml</LINKADRESSE>
    <LINKAUSGABE>Hauptfenster</LINKAUSGABE>
  </LINK>
</MENUE>