<?xml version="1.0" encoding="utf-8" standalone="no"?>
<!DOCTYPE MENUE SYSTEM "../../xml/dtd_xsl/menue.dtd">
<?xml-stylesheet type="application/xml" href="../../xml/dtd_xsl/menue.xsl"?>
<MENUE>
  <MENUENAME>Backenmen&#252;</MENUENAME>
  <LINK>
    <LINKNAME>
    <FETT>Kochbuch</FETT>
    <ZEILENUMBRUCH />
    <ZEILENUMBRUCH />&#160;</LINKNAME>
    <LINKADRESSE>../../index.htm</LINKADRESSE>
    <LINKAUSGABE>_top</LINKAUSGABE>
  </LINK>
  <LINK>
    <LINKNAME>
    <FETT>Backen</FETT>
    <ZEILENUMBRUCH />&#160;</LINKNAME>
    <LINKADRESSE>backenMenue.xml</LINKADRESSE>
    <LINKAUSGABE>Inhalt</LINKAUSGABE>
  </LINK>
  <LINK>
    <LINKNAME>Ananas- Mandarinen- Torte</LINKNAME>
    <LINKADRESSE>../rezepte/backen/ananasMandarinenTorte.xml</LINKADRESSE>
    <LINKAUSGABE>Hauptfenster</LINKAUSGABE>
  </LINK>
  <LINK>
    <LINKNAME>Biskuitboden</LINKNAME>
    <LINKADRESSE>../rezepte/backen/biskuitBoden.xml</LINKADRESSE>
    <LINKAUSGABE>Hauptfenster</LINKAUSGABE>
  </LINK>
  <LINK>
    <LINKNAME>K&#228;setorte ohne Boden</LINKNAME>
    <LINKADRESSE>../rezepte/backen/kaeseOhneBoden.xml</LINKADRESSE>
    <LINKAUSGABE>Hauptfenster</LINKAUSGABE>
  </LINK>
  <LINK>
    <LINKNAME>Kokosmakronen</LINKNAME>
    <LINKADRESSE>../rezepte/backen/kokosMakronen.xml</LINKADRESSE>
    <LINKAUSGABE>Hauptfenster</LINKAUSGABE>
  </LINK>
  <LINK>
    <LINKNAME>Kokospl&#228;tzchen</LINKNAME>
    <LINKADRESSE>../rezepte/backen/kokosPlaetzchen.xml</LINKADRESSE>
    <LINKAUSGABE>Hauptfenster</LINKAUSGABE>
  </LINK>
  <LINK>
    <LINKNAME>Philadelphie- K&#228;se- Torte</LINKNAME>
    <LINKADRESSE>../rezepte/backen/philadelphiaKaeseTorte.xml</LINKADRESSE>
    <LINKAUSGABE>Hauptfenster</LINKAUSGABE>
  </LINK>
  <LINK>
    <LINKNAME>Raffaello Torte</LINKNAME>
    <LINKADRESSE>../rezepte/backen/raffaelloTorte.xml</LINKADRESSE>
    <LINKAUSGABE>Hauptfenster</LINKAUSGABE>
  </LINK>
  <LINK>
    <LINKNAME>Rotk&#228;ppchenkuchen</LINKNAME>
    <LINKADRESSE>../rezepte/backen/rotkaepchenKuchen.xml</LINKADRESSE>
    <LINKAUSGABE>Hauptfenster</LINKAUSGABE>
  </LINK>
  <LINK>
    <LINKNAME>Sprudelkuchen</LINKNAME>
    <LINKADRESSE>../rezepte/backen/sprudelKuchen.xml</LINKADRESSE>
    <LINKAUSGABE>Hauptfenster</LINKAUSGABE>
  </LINK>
  <LINK>
    <LINKNAME>Stachelbeer- Butterkeks- Kuchen</LINKNAME>
    <LINKADRESSE>../rezepte/backen/stachelbeerButterkeksKuchen.xml</LINKADRESSE>
    <LINKAUSGABE>Hauptfenster</LINKAUSGABE>
  </LINK>
  <LINK>
    <LINKNAME>Waffeln</LINKNAME>
    <LINKADRESSE>../rezepte/backen/waffeln.xml</LINKADRESSE>
    <LINKAUSGABE>Hauptfenster</LINKAUSGABE>
  </LINK>
</MENUE>